"Software","Ring","Quadrant","Description"
Apache Ignite,Employ,Management and Monitoring,"Apache Ignite is a distributed database, caching, and in-memory computing platform designed for high-performance, low-latency applications."
Address Doctor,Employ,Platforms,"A software solution that provides address validation and data quality services. It is often used by businesses and organizations to ensure that the addresses they collect and store in their databases are accurate and up-to-date. Address validation is crucial for a variety of purposes, including shipping, marketing, and customer communications."
Gatling,Employ,Development Tools and Automation,Load test tool for DevOps and CI/CD
Next.JS,Employ,Languages and Frameworks,"Next.js is an open-source React framework for building web applications. It provides features such as server-side rendering, static site generation, API routes, and built-in routing, enabling optimized performance and scalable production-ready applications.
"
Vaadin,Employ,Languages and Frameworks,Open source Apache web development 
Oracle Enterprise Manager,Employ,Development Tools and Automation,Oracle Enterprise Manager (OEM) is a set of web-based tools aimed at managing software and hardware produced by Oracle Corporation.
Blue Prism Robotic Process Automation,Deprecate,Development Tools and Automation,<o> SS&C | Blue Prism® offers a powerful combination of market-leading technologies that will help you realize the full potential of intelligent automation to deliver transformational business value. anyone with this use case should explore the use of power automate</p>
azure Fabric,Explore,Management and Monitoring,"<p>A all-in-one analytics platform that unifies data engineering, data integration, data warehousing, real-time analytics, and business intelligence under a single SaaS offering. Rather than stitching together separate Azure services (Synapse, Data Factory, Power BI, etc.), Fabric brings them all into one environment with a shared compute and storage layer.</p>"
BOBJ Reports,Retire,Analytics and Business Intelligence,"<p>a business intelligence (BI) and data analytics software platform developed by SAP SE. It provides a suite of tools and applications designed to help organizations gather, analyze, and visualize data to support data-driven decision-making.</p>"
AccuRoute Fax,Retire,Platforms,"<p>AccuRoute Fax provides secure and comprehensive cloud, hybrid, and on-premise centralized fax infrastructures in an enterprise-class fax solution</p>"
Azure Machine Learning,Explore,Languages and Frameworks,"<p>a cloud-based platform provided by Microsoft as part of the Azure cloud computing services. It is designed to help data scientists and machine learning engineers build, train, and deploy machine learning models and data analytics solutions in a scalable and collaborative manner.</p>"
Golden,Employ,Languages and Frameworks,"<p> A database query and development tool primarily designed for working with Oracle databases. Golden is known for its user-friendly and intuitive interface, making it easier for database professionals, developers, and analysts to interact with Oracle databases efficiently.</p>"
HLTH LDAP,Retire,Platforms,"<p>A directory server product developed by Sun Microsystems, which was later acquired by Oracle. This directory server is designed to store and manage directory information using the Lightweight Directory Access Protocol (LDAP). LDAP is a widely used protocol for accessing and managing directory information, including user accounts, groups, and other organizational data.</p>"
GNU Privacy Guard,Employ,Development Tools and Automation,"<p>a free and open-source software tool that provides cryptographic privacy and authentication for data communication and storage. It is based on the OpenPGP (Pretty Good Privacy) standard and is designed to ensure the confidentiality, integrity, and authenticity of data</p>"
phpMyAdmin,Deprecate,Languages and Frameworks,<p>a free and open-source web-based application that provides a graphical user interface (GUI) for managing and administering MySQL and MariaDB databases.</p>
ImageMagick,Employ,Languages and Frameworks,"<p>a free, open-source software suite, used for editing and manipulating digital images. It can be used to create, edit, compose, or convert bitmap images, and supports a wide range of file formats.</p>vvvvvv"
AWS Systems Manager,Employ,Languages and Frameworks,"<p>A management service provided by Amazon Web Services (AWS) that helps you manage and automate various operational tasks and resources within your AWS environment. It offers a wide range of capabilities designed to simplify system administration, enhance security, and improve resource management.</p>"
AWS Aurora Postgres,Employ,Platforms,"<p>Amazon Aurora is a relational database service offered by Amazon Web Services (AWS). It is designed to provide a highly available, scalable, and performant relational database engine that is compatible with MySQL and PostgreSQL. </p>"
AWS Cloud Front,Employ,Platforms,"<p>Amazon CloudFront is a content delivery network (CDN) service provided by Amazon Web Services (AWS). It is designed to help businesses and developers distribute content, such as web pages, images, videos, and other resources, to end-users with low latency and high data transfer speeds.  </p>"
AWS Cloud Watch,Employ,Management and Monitoring,<p>Amazon CloudWatch is a metrics repository.</p>
DocumentDB,Employ,Platforms,"<p>Amazon DocumentDB is a fully managed, scalable, NoSQL database service provided by Amazon Web Services (AWS). It is designed to store, query, and scale semi-structured JSON data while providing high availability and compatibility with the MongoDB API. </P>"
DynamoDB,Employ,Platforms,"<p> Amazon DynamoDB is a fully managed NoSQL database service provided by Amazon Web Services (AWS). It is designed for developers who need a highly available and scalable database solution for their applications. DynamoDB is known for its speed, flexibility, and seamless integration with other AWS services</p>"
AWS Elastic Container Registry,Employ,Development Tools and Automation,"<p>Amazon Elastic Container Service, is a fully managed container orchestration service provided by Amazon Web Services (AWS). It enables you to easily deploy, manage, and scale containerized applications using Docker containers on a highly scalable and reliable infrastructure.</p>
"
AWS RDS,Explore,Platforms,"<p>Amazon Relational Database Service (RDS) is a collection of managed services that makes it simple to set up, operate, and scale databases in the cloud.</p>"
AWS S3,Employ,Data Management,<p>Amazon S3 or Amazon Simple Storage Service is a service offered by Amazon Web Services that provides object storage through a web service interface. Amazon S3 uses the same scalable storage infrastructure that Amazon.com uses to run its global e-commerce network</p>
Anaconda,Employ,Languages and Frameworks,"<p>Anaconda is an open-source distribution of Python and R programming languages for data science, machine learning, and scientific computing. </p>"
OMTOOL,Inactive,Platforms,"<p>an enterprise document routing solution that integrates with existing mail systems; document management systems and records management systems; multifunction devices and other network hardware such as fax machines, scanners, and copiers; enterprise database applications; and other enterprise business applications</P>"
uploadprogress,Employ,Platforms,<p> an extension for the PHP programming language that is used to track the progress of file uploads. This extension is specifically designed to provide detailed information about the status and progress of files as they are being uploaded to a web server.</p>
Angular,Deprecate,Languages and Frameworks,<p>Angular is a platform for building mobile and desktop web applications</p>
Power BI Report Server,Deprecate,Analytics and Business Intelligence,"<p>an on-premises solution offered by Microsoft as part of the Power BI platform. It allows organizations to host, manage, and distribute Power BI reports and dashboards within their own private network or data center.</p>"
Apache Pinot,Explore,Data Management,"<p>An open-source distributed data analytics and real-time processing platform designed to handle large volumes of data with low latency. Apache Pinot is a column-oriented, open-source, distributed data store written in Java. Pinot is designed to execute OLAP queries with low latency. It is suited in contexts where fast analytics, such as aggregations, are needed on immutable data, possibly, with real-time data ingestion.</p>"
YII Framework,Employ,Platforms,"<p>an open-source, high-performance PHP web application framework designed to simplify and accelerate web development. </p>"
REDIS,Employ,Platforms,"<p> an open-source, in-memory data store that is widely used as a caching mechanism and data storage system. It is known for its speed, simplicity, and versatility, making it a popular choice for a variety of use cases in modern software development.</P>"
JBoss Application Server,Employ,Platforms,"<p>an open-source Java-based application server developed by Red Hat, Inc. It is part of the larger JBoss Enterprise Middleware portfolio</p>"
React Hook Form,Employ,Languages and Frameworks,"<p>an open-source library for managing form state and validation in React applications. It is built on top of React hooks, which are a feature introduced in React 16.8 for managing component state and side effects. </p>"
Jasper iReports,Retire,Analytics and Business Intelligence,"<p>an open-source reporting library and software tool that allows developers to create dynamic, pixel-perfect Jasper Reports in various formats, such as PDF, HTML, and Excel."
SAMBA,Employ,Platforms,"<p> an open-source software suite that enables file and print services to be shared between Windows, Linux, macOS, and other Unix-like operating systems over a network. It allows systems running different operating systems to seamlessly share files and printers as if they were part of the same network, bridging the gap between Windows and non-Windows systems.</p>"
PrimeFaces,Employ,Languages and Frameworks,"<p>an open-source user interface (UI) component library for JavaServer Faces (JSF), a popular Java web application framework. It provides a collection of pre-built UI components and widgets that can be easily integrated into JSF-based web applications, allowing developers to create modern and visually appealing user interfaces.</p>"
Ansible,Explore,Development Tools and Automation,"<p>Ansible is an open-source software provisioning, configuration management, and application-deployment tool enabling infrastructure as code. IIT uses ansible to automate infrastructure and software installations.</P>"
Payara Server,Employ,Platforms,"<p>A open-source, enterprise-grade application server that is compatible with the Java EE (Enterprise Edition) and Jakarta EE (formerly Java EE) specifications. It is designed to host and manage Java applications, including web applications, enterprise applications, and microservices, in production environments.</p>"
Ant,Retire,Development Tools and Automation,"<p>Apache Ant is a Java library and command-line tool used to drive processes described in build files as targets and extension points dependent upon each other. The main known usage of Ant is the build of Java applications. Ant supplies a number of built-in tasks allowing to compile, assemble, test and run Java applications. Ant was widely used to support build for legacy IIT applications but has been largely replaced by Maven.</p>"
Maven,Employ,Development Tools and Automation,"<p>Apache Maven is a software project management and comprehension tool. Based on the concept of a project object model (POM), Maven can manage a project's build, reporting and documentation from a central piece of information. This is the current IIT standard for build.</p>"
Apache Tomcat,Employ,Platforms,"<p>Apache Tomcat® is an open source implementation of the Java Servlet, JavaServer Pages, Java Expression Language and Java WebSocket technologies. Apache Tomcat is the middleware platform for all Oracle Fusion Middleware applications under transformation and all net new java based applications.</p>"
NGINX,Employ,Platforms,"<p>a popular open-source web server, reverse proxy server, and load balancer. It is known for its high performance, scalability, and versatility in serving web content and handling various networking tasks. </p>"
R,Employ,Languages and Frameworks,"<p>a programming language and environment specifically designed for statistical analysis, data visualization, and data manipulation. It is widely used by data scientists, statisticians, and researchers for tasks such as data analysis, machine learning, and statistical modeling.</p>"
Artifactory,Employ,Development Tools and Automation,<p>Artifactory is a Binary Repository Manager product from Jfrog. IIT uses Artifactory in both mode 1 and mode 2 development models to track dependencies and library management.</p>
Shell Script,Employ,Languages and Frameworks,"<p>A shell script is a computer program designed to be run by the Unix shell, a command-line interpreter.</p>"
JNBridge,Deprecate,Platforms,"<p> a software technology and toolset that provides interoperability solutions for integrating Java and .NET (C#) applications. It allows Java and .NET code to communicate and interact seamlessly, enabling developers to build hybrid applications that leverage the strengths of both technologies</p>"
Confluence,Employ,Management and Monitoring,<p>Atlassian Confluence is a knowledge management system</p>
IIS,Employ,Platforms,<p>a web server software developed by Microsoft for hosting and serving web content and applications on Windows Server operating systems</p>
IBM HTTP Server (IHS),Deprecate,Platforms,"<p>a web server software product developed by IBM. It is designed to serve web content and applications and is often used as a front-end web server in conjunction with other IBM software products, including WebSphere Application Server</p>"
HAPI HL7,Employ,Platforms,<p>A widely used Java library for working with HL7 (Health Level Seven) messages and healthcare data exchange in the context of healthcare information technology  </P>
AWS ECS,Employ,Platforms,"<p>AWS ECS is a fully managed container orchestration service that allows you to run and manage Docker containers at scale. It provides a platform for deploying, managing, and scaling containerized applications. ECS handles the infrastructure and cluster management, making it a foundational component for running containerized workloads in the AWS cloud </p>"
AWS Elastic Beanstalk,Explore,Platforms,"<p>AWS Elastic Beanstalk is an orchestration service offered by Amazon Web Services for deploying applications which orchestrates various AWS services, including EC2, S3, Simple Notification Service, CloudWatch, autoscaling, and Elastic Load Balancers.</p>"
AWS Fargate,Employ,Platforms,"<p>AWS Fargate is a serverless container orchestration service provided by Amazon Web Services (AWS). It allows you to run containers without having to manage the underlying infrastructure. With Fargate, you can deploy and manage Docker containers as tasks, and AWS handles the infrastructure provisioning, scaling, and maintenance. </p>"
AWS Secrets Manager,Employ,Management and Monitoring,"<p> AWS Secrets Manager is a service provided by Amazon Web Services (AWS) that helps you protect access to your applications, services, and IT resources without the upfront investment and on-going maintenance costs of operating your infrastructure. It enables you to rotate, manage, and retrieve sensitive credentials, such as database passwords, API keys, and other secrets, securely.</p>"
Payara Micro,Employ,Platforms,"Payara Micro Community is the open source, lightweight middleware platform of choice for containerized Jakarta EE (Java EE)  application deployments."
Azul Open JDK,Employ,Languages and Frameworks,"<p>Azul Zulu provides a stable and reliable version of OpenJDK with long-term support, making it suitable for enterprise applications and organizations that require a certified and well-maintained Java runtime environment. </p>"
Blazor,Employ,Platforms,<p>Blazor is an open-source web framework developed by Microsoft that allows developers to build interactive and dynamic web applications using C# and .NET instead of JavaScript. It enables the development of single-page applications (SPAs) and web applications with rich user interfaces while leveraging the power of the .NET ecosystem.</p>
CICS,Retire,Platforms,<p>CICS is a general-purpose transaction processing subsystem for the z/OS operating system</p>
Azure Storage Services,Employ,Data Management,<p> Cloud file storage in Azure </p>
CMDBuild,Employ,Management and Monitoring,"<p>CMDBuild is a Configuration Managment System - it can be used to track the status of individual IT infrastructure components (often called Configuration Items, or CIs) and their relationships</p>"
Cobol,Retire,Languages and Frameworks,<p>COBOL is a compiled English-like computer programming language designed for business use</p>
HIVE,Employ,Management and Monitoring,<p>Common service for log aggregation and search</p>
Crystal Reports,Retire,Analytics and Business Intelligence,<p>Crystal Reports is a business intelligence application marketed to small- and medium-sized businesses by SAP</p>
Dataguard,Employ,Development Tools and Automation,"<p>Data Guard is a high-availability and disaster recovery solution provided by Oracle for its database management system. It is designed to ensure the availability, reliability, and data protection of Oracle databases by creating and maintaining a standby database that can take over in the event of a primary database failure. </p>"
Datanomics,Employ,Data Management,"<p>Data quality management environment, used to understand, improve, protect and govern data quality.</p>"
DB2,Retire,Platforms,"<p>Db2 is a family of data management products, including database servers, developed by IBM. They initially supported the relational model, but were extended to support object–relational features and non-relational structures like JSON and XML.</p>"
Dependabot,Employ,Development Tools and Automation,"<p> Dependabot is a tool for automating the management of dependencies in software projects. It helps ensure that the libraries and packages your project relies on are kept up-to-date with the latest versions and security patches. Dependabot works with various package managers and programming languages, making it a versatile choice for many development environments.</p>"
GitHub CodeQL,Employ,Development Tools and Automation,"<p>Discover vulnerabilities across a codebase with CodeQL, our industry-leading semantic code analysis engine. CodeQL lets you query code as though it were data. Write a query to find all variants of a vulnerability, eradicating it forever. Then share your query to help others do the same.</p>"
Docker,Employ,Platforms,<p>Docker is a set of platform as a service products that use OS-level virtualization to deliver software in packages called containers. </p>
Drupal,Employ,Platforms,<p>Drupal is a free and open-source web content management system (CMS) written in PHP</p>
Mainframe SOCKC,Retire,Platforms,<p>efers to the SOCKC (Socket Connector) protocol or component used in the context of mainframe computing. SOCKC is often associated with mainframe-based networking and communication.</p>
Sparx EA,Deprecate,Management and Monitoring,"<p>Enterprise Architect helps you trace high-level specifications to analysis, design, implementation, test and maintenance models using UML, SysML, BPMN and other open standards. IIT transitioned to EA from Designer during ISSS development. An assessment is currently underway to determine IIT future usage of EA. ER Studio is emerging as a new data model repository tool.</p>"
Orbus,Inactive,Management and Monitoring,<p>ER Studio is IIT's emerging replacement for Oracle Designer and Enterprise Architect for managing relational data models.</p>
Microsoft OneDrive,Explore,Data Management,"<p> File hosting service and synchronization service operated by Microsoft which BC Government is utilizing, waiting for final decision on this by OCIO </p>

"
Github Actions,Employ,Development Tools and Automation,"<p>GitHub Actions is a continuous integration and continuous delivery (CI/CD) platform that allows you to automate your build, test, and deployment pipeline</p>"
GitHub Secrets,Employ,Management and Monitoring,"<p> GitHub Actions Secrets, are a way to securely store sensitive information or environment variables that are used in GitHub Actions workflows. These secrets are encrypted and can be accessed by your workflows during their execution, ensuring that sensitive data like API tokens, passwords, or other authentication credentials are kept safe. </p>"
GitHub,Employ,Development Tools and Automation,"<p>Github offers all of the distributed version control and source code management (SCM) functionality of Git as well as adding its own features. It provides access control and several collaboration features such as bug tracking, feature requests, task management, and wikis for every project. Github is the IIT standard for source control. The province has two organizations registered with github called bcgov and BCDevOps</p>"
GlassFish Application Server,Retire,Platforms,"<p>GlassFish is an open-source Jakarta EE platform application server project started by Sun Microsystems, then sponsored by Oracle Corporation</p>"
HAPROXY,Employ,Platforms,"<p>HAProxy is a free, very fast and reliable solution offering high availability, load balancing, and proxying for TCP and HTTP-based applications.</p>"
Vault,Employ,Management and Monitoring,"<p> HashiCorp Vault provides capabilities to secure, store and tightly control access to tokens, passwords, certificates, encryption keys for protecting credentials and other sensitive data using a UI, CLI, or HTTP API. </p>"
Symphonia,Inactive,Platforms,<p>HL7v2 validation software</P>
Hyperic Server,Retire,Management and Monitoring,<p>Hyperic is a cross platform monitoring system which is designed to monitor and control server resources. </p>
IBM Initiate,Employ,Platforms,"<p>IBM Initiate is a enterprise master patient index, which ensures patient data is correct and consistent throughout the organization regardless of which system is being updated</p>"
MQSeries,Deprecate,Platforms,"<p>IBM MQ is a family of message-oriented middleware products. It allows independent and potentially non-concurrent applications on a distributed system to securely communicate with each other, using messages.</p>"
VAGEN,Inactive,Platforms,"<p>IBM VAGEN is a tool used in the context of IBM mainframe systems and application development. VAgen stands for ""Virtual Application Generator,"" and it is a part of IBM's CICS (Customer Information Control System) software suite.</p>"
IMS,Retire,Platforms,<p>IMS is a message-based transaction manager and hierarchical-database manager for z/OS</p>
InfoSphere Master Data Management (MDM),Employ,Platforms,"<p>InfoSphere Master Data Management (MDM) is a software solution developed by IBM that enables organizations to manage and govern their business data, often referred to as master data, in a centralized and standardized manner. Health master data typically includes information about providers or citizens, and other core entities that are essential to deliver health care. InfoSphere MDM helps organizations achieve data consistency, accuracy, and a single version of the truth across the enterprise.</p>"
Camel,Employ,Platforms,<p>Integration Broker for Health Business Services </p>
OWASP Zap,Employ,Development Tools and Automation,"<p> is an open-source security testing tool designed to help find security vulnerabilities in web applications during the development and testing phases. It is one of the many valuable projects under the Open Web Application Security Project (OWASP) umbrella, which focuses on improving the security of software.</p>"
EJB3,Deprecate,Languages and Frameworks,<p>Jakarta Enterprise Beans (EJB; formerly Enterprise JavaBeans) is one of several Java APIs for modular construction of enterprise software. EJB is a server-side software component that encapsulates business logic of an application</p>
Jakarta Faces,Employ,Languages and Frameworks,"<p>Jakarta Faces defines an MVC framework for building user interfaces for web applications, including UI components, state management, event handling, input validation, page navigation, and support for internationalization and accessibility.</p>"
JasperReports Server,Retire,Analytics and Business Intelligence,"<p>JasperReports Server is a stand-alone and embeddable reporting server. It provides reporting and analytics that can be embedded into a web or mobile application as well as operate as a central information hub for the enterprise by delivering mission critical information on a real-time or scheduled basis to the browser, mobile device, or email inbox in a variety of file formats. This is the standard reports engine for IIT.</p>"
Java,Employ,Languages and Frameworks,"<p>Java is a class-based, object-oriented and general purpose programming language. Add IIT Context.</p>"
Oracle JAVA,Inactive,Languages and Frameworks,"<p>Java is a high-level, general-purpose programming language and computing platform developed by Sun Microsystems, which is now owned by Oracle Corporation.</p>"
