"Software","Ring","Quadrant","Description"
Jenkins,Deprecate,Development Tools and Automation,"<p>Jenkins is a popular open source automation server, Jenkins provides hundreds of plugins to support building, deploying and automating any project. Jenkins is widely used in IIT for build and deployment automation, in both mode 1 and mode 2 development patterns.</p>"
Jira,Employ,Management and Monitoring,<p>Jira is a issue tracking product developed by Atlassian that allows bug tracking and agile project management.</p>
JUnit,Employ,Development Tools and Automation,<p>JUnit is a unit testing framework for the Java programming language. </p>
KeePass,Deprecate,Management and Monitoring,"<p>KeePass is a free and open source, light-weight and easy-to-use password manager primarily for windows. By default KeePass database is stored on local file systems. IIT currently uses KeePass for some credential management. IIT is actively replacing its use of keepass with Vault Hashicorp</p>"
Keycloak,Employ,Platforms,"<p>Keycloak is an open source Identity and Access Management solution aimed at modern applications and services. It makes it easy to secure applications and services with little to no code. Projects being developed on the Openshift platform in the DevExchange are largely using Keycloak, and IIT is currently assessing Keycloak as a replacement for WebADE.</p>"
Log4j,Employ,Management and Monitoring,<p>Log4j is a logging library for Java. It improves on other logging libraries by providing greater extensibility and reliability.</p>
Multi-Master Replication,Inactive,Platforms,<p>Log-Based Change Data Capture w/ Transactional Integrity</p>
Java Message Broker,Retire,Platforms,<p>Messaging middleware or message broker system built on Java technologies. A message broker is a software component that facilitates communication and data exchange between different applications or components in a distributed computing environment.</p>
Application Lifecycle Management,Deprecate,Development Tools and Automation,<p>Micro Focus Application Lifecycle Management is a set of software tools developed and marketed by Micro Focus for application development and testing. Should be replaced by Zephyr  or Xray</P>
MS Access,Retire,Platforms,<p>Microsoft Access is a database management system from Microsoft that combines the relational Microsoft Jet Database Engine with a graphical user interface and software-development tools.</p>
MS Biztalk,Inactive,Platforms,<p>Microsoft BizTalk Server is an inter-organizational middleware system that automates business processes through the use of adapters which are tailored to communicate with different software systems used in an enterprise.</p>
MicroStrategy BI,Deprecate,Analytics and Business Intelligence,"<p>MicroStrategy is an enterprise business intelligence (BI) application that supports interactive dashboards, scorecards, highly formatted reports, ad hoc query, thresholds and alerts, and automated report distribution.  This should be converted to PowerBI</p>"
Moodle,Employ,Management and Monitoring,<p>Moodle is a free and open-source learning management system written in PHP and distributed under the GNU General Public License.</p>
MYSQL,Employ,Platforms,<p>MySQL is an open-source relational database management system (RDBMS) that is stewarded by Oracle Corporation. IIT uses MySQL as an open source data store for COTS applications where PostgreSQL is not an option.</p>
.NET Core,Employ,Languages and Frameworks,"<p>.NET Core is a free and open-source, managed computer software framework for Windows, Linux, and macOS operating systems. It is a cross-platform successor to.NET Framework.</p>"
Node.js,Employ,Languages and Frameworks,"<p>Node.js is an open-source, cross-platform, JavaScript runtime environment (Framework) that executes JavaScript code outside a web browser. Node.js represents a ""JavaScript everywhere"" paradigm unifying web-application development around a single programming language, rather than different languages for server-side and client-side scripts. Need IIT context.</p>"
XBASE++,Inactive,Platforms,<p> object-oriented programming language and development environment primarily used for creating desktop and client-server applications. It is known for its compatibility with the dBASE programming language and its ability to create database-driven software solutions.</p>
Dell Object Store,Explore,Data Management,"<p> Object Storage Service is for Ministry Clients (Hosted within Government DataCentres) to store data as objects using standard protocols including S3, NFS, and HTTP </p>"
OC4J Application Server,Inactive,Platforms,"</p>OC4J (Oracle Containers for J2EE) was a Java EE (Java Platform, Enterprise Edition) application server developed by Oracle Corporation. It was part of the Oracle Application Server suite and provided a runtime environment for deploying and running Java EE applications.</p>"
Visual Studio Code,Employ,Languages and Frameworks,"<p>open-source code editor developed by Microsoft. It is designed to be a lightweight yet powerful tool for software development, supporting a wide range of programming languages and development workflows.  </p>"
Patroni,Employ,Platforms,"<p>Open-source high-availability (HA) solution for PostgreSQL, a popular open-source relational database management system (RDBMS). It is designed to provide automated failover and high availability for PostgreSQL database clusters, ensuring that database services remain available in the event of server failures or other issues.</p>"
OpenSSL,Employ,Development Tools and Automation,"<p>OpenSSL is a software library for applications that secure communications over computer networks against eavesdropping or need to identify the party at the other end. It is widely used by Internet servers, including the majority of HTTPS websites.</p>"
APEX,Deprecate,Languages and Frameworks,<p>Oracle APEX is a proprietary web-based integrated development environment developed by Oracle Corporation for creating and managing Oracle databases and other related database functionality.</p>
Oracle Database,Employ,Platforms,<p>Oracle database is a relational database management system (RDBMS) from the Oracle Corporation. Oracle has been widely used by MoH and continues to be a supported platform. The Oracle database is licensed by the number of cores on the hosting server.  Should not be used for anything new</p>
Oracle Forms,Inactive,Platforms,"<p>Oracle Forms, a component of Oracle Fusion Middleware, is Oracle's tool for creating and generating forms. This technology has been deprecated by IIT in favor of Orbeon Forms.</p>"
Oracle Fusion Middleware,Retire,Platforms,"<p>Oracle Fusion Middleware is a middlware platform used by a large majority of legacy IIT applications. It includes the Weblogic java server, the Unified Business and SOA suites (ISSS applications only) and Oracle Forms and Reports (deprecated). Tomcat is preferred over OFM.</p>"
OHS,Inactive,Platforms,<p>Oracle HTTP Server</p>
OID,Inactive,Platforms,<p>Oracle Internet Directory</p>
Oracle OPEN JDK,Inactive,Languages and Frameworks,"<p>Oracle OpenJDK, also known as Oracle's Open Source Java Development Kit, is a distribution of the Java Development Kit (JDK) that is provided and maintained by Oracle as part of the open-source community. OpenJDK is the official reference implementation of the Java Platform, Standard Edition (Java SE) specifications, and Oracle's OpenJDK distribution is one of several available distributions of OpenJDK.</p>"
Oracle Reports,Inactive,Analytics and Business Intelligence,"<p>Oracle Reports, a component of Oracle Fusion Middleware, is Oracle's enterprise reporting tool. This technology has been deprecated by IIT.</p>"
Oracle REST Data Services (ORDS),Retire,Platforms,"<p>Oracle REST Data Services (ORDS) is a free, open-source tool developed by Oracle Corporation that enables users to turn their Oracle databases into RESTful web services. ORDS provides a set of features and capabilities that allow developers and organizations to expose data and database operations via a RESTful API</p>"
Oracle Solaris,Inactive,Platforms,"<p>Oracle Solaris is a Unix based platform acquired by Oracle as part of the Sun Microsystems purchase. Prior to widespread adoption of Linux, IIT used the Solaris platform for database and middleware servers. Solaris has been marked as end of life and IIT prefers Linux for all new builds.</p>"
Perl,Retire,Languages and Frameworks,"<p>Perl is a high-level, general-purpose, interpreted, dynamic programming language.</p>"
PHP,Employ,Platforms,<p>PHP is a general-purpose scripting language geared towards web development.</p>
PostgreSQL DB,Employ,Platforms,<p>PostgreSQL is an open source relational database management system and is endorsed as an IIT preferred technology. Emerging LOB systems should target PostgreSQL for relational database management.</p>
PowerBI Cloud,Employ,Analytics and Business Intelligence,<p>PowerBI is a Microsoft BI Product</p>
EZproxy,Employ,Platforms,<p>Proxy server software that provides remote access to libraries' licensed databases and other online resources.</p>
Python,Employ,Languages and Frameworks,"<p>Python is a clear, general purpose and object-orientated programming language, comparable to Perl, Ruby or Java. Add IIT Context.</P>"
Quarkus,Explore,Platforms,"<p>Quarkus is a full-stack, Kubernetes-native Java framework made for Java virtual machines (JVMs) and native compilation, optimizing Java specifically for containers and enabling it to become an effective platform for serverless, cloud, and Kubernetes environments. IIT exploring use cases including in conjunction with GraalVM. Improve IIT context wording.</P>"
ARCGIS,Retire,Platforms,"<p> rcGIS is a suite of geographic information system (GIS) software products developed by Esri (Environmental Systems Research Institute). GIS is a technology that allows users to create, analyze, visualize, and manage geographic data to make informed decisions. </p>"
React.JS,Employ,Languages and Frameworks,<p>React is a free and open-source front-end JavaScript library for building user interfaces or UI components. It is maintained by Facebook and a community of individual developers and companies. React can be used as a base in the development of single-page or mobile applications.</p>
Red Hat Linux,Employ,Platforms,"<p>Red HatÃ‚Â® Enterprise LinuxÃ‚Â® is one of the most popular Linux platforms, and the favored Linux platform offered by our hosting provider DXC. ItÃ¢â‚¬â„¢s the foundation from which you can scale existing appsÃ¢â‚¬â€and roll out emerging technologiesÃ¢â‚¬â€across bare-metal, virtual, container, and all types of cloud environments.</p>"
RedHat Open JDK,Deprecate,Languages and Frameworks,"<p>Red Hat OpenJDK is a distribution of the Java Development Kit (JDK) provided and supported by Red Hat, a well-known company in the enterprise Linux and open-source software space. Red Hat OpenJDK is based on the open-source OpenJDK project and is designed to provide a stable and reliable platform for Java application development and deployment. Here are some key points about Red Hat OpenJDK.</p>"
Siteminder Agent,Deprecate,Platforms,<p>refers to a critical component of CA Single Sign-On that is responsible for enforcing access policies and ensuring secure authentication and authorization for users accessing web resources. </p>
C++,Employ,Languages and Frameworks,<p>Replaced with .NET</P>
Salesforce,Employ,Platforms,"<p> Salesforce provides customer relationship management service and also provides a complementary suite of enterprise applications focused on customer service, marketing automation, analytics, and application development.</p>"
SAS Analytics,Employ,Analytics and Business Intelligence,"<p>SAS is a statistical software suite developed by SAS Institute for data management, advanced analytics, multivariate analysis, business intelligence, criminal investigation, and predictive analytics</p>"
SAS-Analytics,Employ,Analytics and Business Intelligence,"
<p>SAS is a statistical software suite developed by SAS Institute for data management, advanced analytics, multivariate analysis, business intelligence, criminal investigation, and predictive analytics</p"
Globalscape SFTP,Employ,Platforms,"<p>  secure file transfer server solution designed to facilitate the exchange of files and data securely within organizations and between business partners. Among its many features, EFT Express supports the SFTP (Secure File Transfer Protocol) standard for secure and encrypted file transfers.</p>"
Selenium,Deprecate,Development Tools and Automation,<p> Selenium is a portable framework for testing web applications. Selenium provides a playback tool for authoring functional tests without the need to learn a test scripting language</p>
ServiceNow,Employ,Management and Monitoring,<p>Service Now is a leading ITSM tool used by help desk and the Access Team</p>
Sharepoint,Employ,Management and Monitoring,"<p>SharePoint is a web-based collaboration platform that enables organizations to create, manage, and share documents, content, and information. It includes features for document management, version control, workflow automation, and collaboration among teams and departments</p>"
Siebel,Retire,Platforms,"<p>Siebel CRM Systems, Inc. was a software company principally engaged in the design, development, marketing, and support of customer relationship management applications</p>"
Oracle Database Client,Deprecate,Platforms,"<p>Software or applications that allow users or developers to interact with a database. Database clients provide a graphical user interface (GUI) or command-line interface (CLI) for performing various database-related tasks, including querying, inserting, updating, and deleting data.</p>"
Solr,Employ,Platforms,"<p>Solr is an open-source enterprise-search platform, written in Java. Its major features include full-text search, hit highlighting, faceted search, real-time indexing, dynamic clustering, database integration, NoSQL features and rich document handling</p>"
SonarQube,Explore,Development Tools and Automation,"<p>SonarQube is an open-source platform for continuous inspection of code quality to perform automatic reviews with static analysis of code to detect bugs, code smells, and security vulnerabilities. IIT uses Sonarqube for code quality checking as part of the build process for container based applications.</p>"
Splunk,Employ,Management and Monitoring,"<p>Splunk is software for searching, monitoring, and analyzing machine-generated data via a Web-style interface.</p>"
Spring Boot,Employ,Languages and Frameworks,<p>Spring Boot is an open source Java-based framework</p>
SQL Server Express,Deprecate,Platforms,"<p>SQL Server Express is a free, lightweight, and feature-limited edition of Microsoft's SQL Server relational database management system (RDBMS).</p>"
SQL Server,Employ,Platforms,"<p>SQL Server is a relational database server by Microsoft. IIT has a substantial install base for SQL Server, most of which is to support smaller COTS applications. SQL Server is a licensed product, either by CPU cores on the hosted server or a negotiated named user model.</p>"
bUnit,Employ,Development Tools and Automation,"<p><strong><a href=""https://bunit.egilhansen.com/"">bUnit</a></strong> is a testing library for <a href=""/radar/languages-and-frameworks/blazor"">Blazor</a> that makes it easy to create tests for Blazor components in existing unit testing frameworks such as NUnit, xUnit or MSUnit. It provides a facade around the component allowing it to be run and tested within the familiar unit test paradigm, thus allowing very fast feedback and testing of the component in isolation. If you're developing for Blazor, we recommend that you add bUnit to your list of tools to try out.</p>"
Delta Lake,Explore,Data Management,"<p><strong><a href=""https://delta.io/"">Delta Lake</a></strong> is an <a href=""https://github.com/delta-io/delta"">open-source storage layer</a>, implemented by Databricks, that attempts to bring ACID transactions to big data processing. In our Databricks-enabled <a href=""/radar/techniques/data-lake"">data lake</a> or <a href=""/radar/techniques/data-mesh"">data mesh</a> projects, our teams continue to prefer using Delta Lake storage over the direct use of file storage types such <a href=""https://aws.amazon.com/s3/"">S3</a> or <a href=""https://azure.microsoft.com/en-au/services/storage/data-lake-storage/"">ADLS</a>. Of course this is limited to projects that use storage platforms that support <a href=""https://docs.delta.io/latest/delta-storage.html"">Delta Lake</a> when using <a href=""https://parquet.apache.org/"">Parquet</a> file formats. Delta Lake facilitates concurrent data read/write use cases where file-level transactionality is required. We find Delta Lake's seamless integration with Apache Spark <a href=""https://docs.databricks.com/delta/delta-batch.html"">batch</a> and <a href=""https://docs.databricks.com/delta/delta-streaming.html"">micro-batch</a> APIs greatly helpful, particularly features such as <a href=""https://databricks.com/blog/2019/02/04/introducing-delta-time-travel-for-large-scale-data-lakes.html"">time travel</a> — accessing data at a particular point in time or commit reversion — as well as <a href=""https://databricks.com/blog/2019/09/24/diving-into-delta-lake-schema-enforcement-evolution.html"">schema evolution</a> support on write; though there are some limitations on these features.</p>"
Subversion,Deprecate,Development Tools and Automation,<p>Subversion is an open source version control system used for legacy IIT applications. IIT has transitioned all source code repositories to Bitbucket or Github.</p>
Terraform,Employ,Development Tools and Automation,"<p> Terraform is an infrastructure as code (IaC) tool created by HashiCorp. It enables users to define and provision infrastructure resources and services in a declarative manner, using configuration files. Terraform allows you to manage and automate the deployment and management of infrastructure across various cloud providers, on-premises data centers, and other infrastructure platforms.</p>"
Terragrunt,Employ,Development Tools and Automation,"<p>Terragrunt is an open-source tool developed by Gruntwork that acts as a thin wrapper for Terraform, another popular infrastructure-as-code (IaC) tool. Terragrunt helps users manage and organize their Terraform configurations in a more modular and scalable way, especially in large and complex infrastructure projects.</p>"
TestCafe,Employ,Development Tools and Automation,<p>Test Cafe is a Node. js end-to-end free and open source automation tool which is used to test web applications. </p>
Draw.io,Employ,Languages and Frameworks,<p>test</p>
Apache HTTP Server,Employ,Platforms,<p>The Apache HTTP Server is a free and open-source cross-platform web server software</p>
AWS Cloud Development Kit,Explore,Languages and Frameworks,"<p>The AWS Cloud Development Kit (CDK) is an open-source software development framework provided by Amazon Web Services (AWS). It is designed to help developers define cloud infrastructure in code and provision AWS resources using familiar programming languages, such as TypeScript, Python, Java, and C#/.NET, rather than using traditional infrastructure-as-code (IAC) templates like AWS CloudFormation's JSON or YAML.</p>"
Openshift,Employ,Platforms,"<p>The BC Gov OpenShift Container Platform Service is a multi-tenant container platform that government application development teams may use to develop and deploy modern, cloud native software applications. The service provides development teams with a set of isolated project spaces (namespaces) with associated resource quotas in which they can develop and deploy their applications and tools supporting their development lifecycle. Openshift is the defacto platform for IIT's DevOps initiatives. Migrating to Openshift 4 in fall 2020.</p>"
Sun Java System Web Server,Inactive,Platforms,"<p>This web server software was designed to serve web content, host websites, and handle HTTP requests and responses.</p>"
Unison,Employ,Platforms,<p>Unison is a file synchronization and sharing software program designed to help users keep files and folders up-to-date across multiple devices and locations.</p>
Vue.js,Employ,Languages and Frameworks,"<p>Vue.js is an open-source JavaScript framework for building user interfaces and single-page applications. IIT architecture does not promote a single javascipt framework over another and is as a local development project decision. Factors like specific project requirements, integrations with other BC Gov appliacations, and team composition and experience with a given framework will influence and inform choices in selecting a framework.</p>"
ASP.NET,Employ,Languages and Frameworks,"<p> web development framework developed by Microsoft. It enables developers to build dynamic and interactive web applications, websites, and services using the .NET platform. ASP.NET offers a variety of tools, libraries, and technologies to streamline web development and create robust, scalable, and secure web applications.</p>"
AccuRoute Web Client,Retire,Platforms,<p>Web Interface for AccuRoute Fax.</P>
Weblogic Application Server,Deprecate,Platforms,"<p>WebLogic Server, often referred to as Oracle WebLogic Server, is a widely used enterprise-level application server developed by Oracle Corporation. It is designed to host and manage Java-based enterprise applications, providing a robust, scalable, and secure runtime environment.</p>"
WebSphere,Employ,Platforms,<p>WebSphere application server is a software framework and middleware that hosts Java-based web applications. It is the flagship product within IBM's WebSphere software suite.</p>
.NET,Employ,Languages and Frameworks,"<p>We don't call out every new .NET version in the Radar, but <strong>.NET 5</strong> represents a significant step forward in bringing .NET Core and .NET Framework into a single platform. Organizations should start to develop a strategy to migrate their development environments — a fragmented mix of frameworks depending on the deployment target — to a single version of .NET 5 or 6 when it becomes available. The advantage of this approach will be a common development platform regardless of the intended environment: Windows, Linux, cross-platform mobile devices (via <a href=""/radar/tools/xamarin"">Xamarin</a>) or the browser (using <a href=""/radar/languages-and-frameworks/blazor"">Blazor</a>). While polyglot development will remain the preferred approach for companies with the engineering culture to support it, others will find it more efficient to standardize on a single platform for .NET development. For now, we want to keep this in the Assess ring to see how well the final unified framework performs in .NET 6.</p>"
What's Up Gold,Employ,Management and Monitoring,"<p>WhatsUp Gold provides complete visibility into the status and performance of applications, network devices and servers on-premises and is the primary monitoring system for ITSB applications</p>"
Wildfly (JBoss),Employ,Platforms,"<p>WildFly, formerly known as JBoss AS, or simply JBoss, is an application server authored by JBoss, now developed by Red Hat. WildFly is written in Java and implements the Java Platform, Enterprise Edition specification.</p>"
ISPF,Deprecate,Languages and Frameworks,"<p>With ISPF, you can manipulate source code and data stored on a host and work with interactive applications called dialogs. Programmers can use ISPF to develop and document batch and interactive programs. IBM Z® systems administrators and systems programmers can use ISPF to monitor and control program libraries and communications with IBM z/OS®.</p>"
Common Hosted Form Service,Employ,Data Management,"<p>With this service we can publish the forms through the Common Hosted Form Service and generate a quick response code to share access with respondents. When users complete a form, you can validate responses and export the data.</p>"
POSIT Connect,Employ,Analytics and Business Intelligence,RStudio integrated development environment (IDE) is a set of tools built to help you be more productive with R and Python.
SQL Server Management Studio,,Management and Monitoring,"SQL Server Management Studio (SSMS) is an integrated environment for managing any SQL infrastructure. Use SSMS to access, configure, manage, administer, and develop all components of SQL Server, Azure SQL Database, Azure SQL Managed Instance, SQL Server on Azure VM, and Azure Synapse Analytics. SSMS provides a single comprehensive utility that combines a broad group of graphical tools with many rich script editors to provide access to SQL Server for developers and database administrators of all skill levels."
,Employ,Languages and Frameworks,
Hub,,Development Tools and Automation,
Siebel Innovation Pack 2018,Retire,Platforms,
InsightId,Employ,Data Management,
Siebel Innovation Pack 2015,Retire,Platforms,
Spring Batch,Employ,Languages and Frameworks,
Library Relations Managers,Employ,Management and Monitoring,
Container as a service in AWS,Employ,Platforms,
AWStats,Deprecate,Management and Monitoring,
PowerBi Desktop,Employ,Analytics and Business Intelligence,
